Name,City,Comments,Country,Date Posted,Duration,Lat,Long,Shape,SS Status,Unique ID
378-amelia-light,amelia,We saw a large spotlight at about 100-150 ft directly above us. It had one flashing red light above the spotlight and two white light,us,03/07/2018,300,39.02833,-84.21778,light,Pending,SS-7963
3792-au-light,geraldton (australia),flashing lightsno noisemoved like a bee flew slowlyalso very quickly,au,12/02/2019,60,-28.77897,114.61459,light,Active,SS-9001
379-renton-sphere,renton,I was watching TV in my brothers room when something in his window caught my eye.  At first it looked like a balloon in the far off dis,us,03/07/2018,300,47.48306,-122.21583,sphere,Closed,SS-7960
37-las vegas-sphere,las vegas,Bright green comet streak.,us,11/01/2018,2,36.17500,-115.13639,sphere,Active,SS-8300
380-worsley manchester (uk/england)-teardrop,worsley manchester (uk/england),Tear drop shape emitting dull gold glow at around 7000 feet. Moving at same speed as airliners in landing pattern in same vicinity.,us,03/07/2018,120,53.50754,-2.39120,teardrop,Active,SS-7961
381-brooklyn-disk,brooklyn,Flat round object heading rapidly SE horizontally.I was on my way home from work on roads Ive travelled at this time of day for t,us,03/07/2018,2,41.78806,-71.95028,disk,Active,SS-7958
3829-au-other,central coast (nsw australia),Spooky stuff the truth is no longer out there in my opinion,au,12/02/2019,1800,-33.42979,151.37144,other,Active,SS-9000
382-south attleboro-disk,south attleboro,At dusk on perfectly clear night saw large blue bright disk fly vertically down and skim out over the earth. As it pulled out of its d,us,03/07/2018,7,41.90833,-71.36250,disk,Pending,SS-7959
383-eden-light,eden,Circular light image moving in an arc downward.  Brightly lit white-yellow with warmer tones flaring out on the bottom.  Its size was,us,03/07/2018,60,42.65222,-78.89722,light,Closed,SS-7956
384-pottstown-triangle,pottstown,multiple craft of various shapes. All with red &amp; white lights some pulsing some strobe. Silent. Eventually chased off by jets. Moveme,us,03/07/2018,5400,40.24528,-75.65000,triangle,Active,SS-7957
385-cape coral-light,cape coral,a white object was traveling in the eastern sky when we saw a huge blue and red burst of flame speed up the object and travel very fast,us,03/07/2018,120,26.56250,-81.94972,light,Active,SS-7954
3865-gb-triangle,london (sw8.4jq) (uk/england),IT WAS WEDGE SHAPED SILVER AND SHINING AND SILENT.,gb,12/02/2019,900,51.51412,-0.09369,triangle,Closed,SS-8761
386-winter springs-Sleigh,winter springs,The sleigh was roof high and I observed it very closely for at least 3 to 5 minutes,us,03/07/2018,300,28.69861,-81.30833,Sleigh,Active,SS-7955
3876-gb-Sleigh,tadley (uk/england),cluster of Sleighs over Hampshire England,gb,12/02/2019,2400,51.33333,-1.11667,Sleigh,Active,SS-8764
387-blairsville-light,blairsville,Low flying aircraft hovering above elementary schoolIt was 11:35 pm and I was driving west from Bolivar Pa to blairsville on route,us,03/07/2018,300,40.43111,-79.26111,light,Pending,SS-7952
388-pittsburgh-other,pittsburgh,A LARGE CRAFT WITH FIVE SMALL FLOATING LIGHTS SURROUNDING IT HOVERED OVER EDGEWOOD FOR A SHORT AMOUNT OF TIME THEN SEEMED TO VANISH.,us,03/07/2018,1200,40.44056,-79.99611,other,Active,SS-7953
38-vancouver-light,vancouver,I saw a green phosphorous light in the sky west from Vancouver Washington and a bit to the south appearing to drop with a very slight,us,11/01/2018,5,45.63889,-122.66028,light,Active,SS-8297
3900-gb-other,todmorden (uk/england),1 craft was seen at close range no more than 30 feet away looked like a hovercraft with a bank of dark black windows dull silver in col,gb,12/02/2019,36,53.71667,-2.08333,other,Closed,SS-8762
390-thackery-Sleigh,thackery,Objects that move much more quickly than airplanes.  They moved strait up and down even below tree tops.  They would stay still for man,us,03/07/2018,5,40.05556,-83.91889,Sleigh,Active,SS-7950
391-los angeles-triangle,los angeles,At 20:15 Pacific time on 2/23/96 while out on balconywith telescope looked west south westand saw 3 triangularshaped objects with a,us,03/07/2018,120,34.05222,-118.24278,triangle,Active,SS-7951
392-ironwood-Sleigh,ironwood,A small Sleigh we chased in a Piper Cherokee plane.  Object led us in a circle then passed below us.,us,03/07/2018,1200,46.45472,-90.17083,Sleigh,Active,SS-7949
3932-gb-Sleigh,bridgnorth (uk/england),Very fast - in sleigh flying lights with NO sound and vanishing,gb,12/02/2019,2,52.53333,-2.41667,Sleigh,Active,SS-8760
393-crystal lake-sphere,crystal lake,I was laying on the sofa looking out the window at 2:00am with the Moon and Mars in the sky and all of the sudden I saw an orange-red b,us,03/07/2018,4,42.24111,-88.31611,sphere,Pending,SS-7948
394-boiling springs (outside of traveling on highway)-Sleigh,boiling springs (outside of traveling on highway),Observed unidentified object apparently following AirlinerMy four year old son and I were returning from shopping at approximately,us,03/07/2018,15,40.14972,-77.12861,Sleigh,Active,SS-7947
3951-gb-Sleigh,penrith (uk/england),Lights in the sky moving in sleigh at great speeds.,gb,12/02/2019,3600,54.65000,-2.73333,Sleigh,Active,SS-8759
395-new florence-light,new florence,Bright Light in the East Hovering,us,03/07/2018,1800,40.38028,-79.07556,light,Active,SS-7946
396-gb-light,london (uk/england),A LIGHT FOLLOWED AN AEROPLANE AND THEN THEY BOTH VANISHED.I WAS GOING DOWN THE M25.(A MOTORWAY GOING AROUND LONDON) WITH MY DAD.  I,gb,03/07/2018,180,51.51412,-0.09369,light,Closed,SS-8789
397-st. david-Sleigh,st. david,Sighted grey metallic sleigh with no lights   hovering over the Whetstone Mts.  Watched it for about an hour.,us,03/07/2018,3600,31.90417,-110.21361,Sleigh,Active,SS-7945
398-grove city-Sleigh,grove city,Had a alien possible abduction very hard to talk about it. Remember hearing  buzzing sound and 6 small grey figures that  passed out.,us,03/07/2018,10800,41.15778,-80.08889,Sleigh,Pending,SS-7944
399-lufkin-delta,lufkin,Family traveling home along a rural farm road spotted unusual lights/object in the sky moving slowly from east to west and pulled over,us,03/07/2018,420,31.33806,-94.72889,delta,Active,SS-7943
39-big arm-disk,big arm,Facing East clear sky characterized by bright light blinking at very cadence from one to five.  Movement pattern was up down then t,us,11/01/2018,600,47.79806,-114.29389,disk,Active,SS-8298
3-las vegas-Sleigh,las vegas,The sleigh was roof high and I observed it very closely for at least 3 to 5 minutes,us,11/01/2018,600,36.17500,-115.13639,Sleigh,Active,SS-8335
4001-gb-Sleigh,newcastle (uk/england),followed by a Sleigh,gb,12/02/2019,180,54.20000,-5.88333,Sleigh,Active,SS-8758
400-coconino natl forest north of wupatki nm az-sleigh,coconino natl forest north of wupatki nm az,Man and woman observe cluster of about 8 motionless blinking blue lights (not in sync) lazer-like pulses of light between them and g,us,03/07/2018,900,34.04893,-111.09373,sleigh,Pending,SS-7942
401-charleston-sphere,charleston,3 brightorange objects with comet-like tails movingtoward earth then toward each other thenhorizontally east to s.west,us,03/07/2018,900,38.34972,-81.63278,sphere,Active,SS-7941
4028-gb-sphere,ipswich (uk/england),3 glowing spheres bobbing east to northwest over ipswich UK at 10pm on 30/8/00,gb,12/02/2019,8,52.08333,1.16667,sphere,Pending,SS-8756
402-new orleans-other,new orleans,Are you interested in unexplained noises?,us,03/07/2018,10,29.95444,-90.07500,other,Pending,SS-7940
403-glendale (ssw of)-light,glendale (ssw of),Stationary object SW of the Phoenix AZ area seen over several nights. Quit appearing after the Mar 13 incident in Phoenix.,us,03/07/2018,1814400,33.53861,-112.18528,light,Active,SS-7939
404-newfoundland-oval,newfoundland,Driving N/W on Rt. 23 on the way home from 3rd shift. After passing thru a trarric lite i noticed a glimmer off to the left hand side.,us,03/07/2018,300,41.04639,-74.43556,oval,Active,SS-7938
405-east mesa /apache junction.-light,east mesa /apache junction.,I came home after work at about 9pm 3/13/997.  My children ages 78&amp; 11 had been in the backyard all evening. When I arrived they,us,03/07/2018,120,33.49421,-111.64125,light,Active,SS-7936
406-kingman-Sleigh,kingman,5 BRIGHT orange lights flying in a V sleigh,us,03/07/2018,360,35.18944,-114.05222,Sleigh,Active,SS-7937
407-phoenix-Sleigh,phoenix,The sleigh was roof high and I observed it very closely for at least 3 to 5 minutes,us,03/07/2018,600,33.44833,-112.07333,Sleigh,Pending,SS-7935
4086-gb-triangle,southampton (uk/england),large near black object triangle in shape,gb,05/03/2019,15,50.90000,-1.40000,triangle,Pending,SS-8757
408-prescott-Sleigh,prescott,v sleigh white lights to start with at long range as it got closer looking through binoculars each light was actually 2 one red one,us,03/07/2018,300,34.54000,-112.46778,Sleigh,Active,SS-7934
409-phoenix (ahwatukee)-triangle,phoenix (ahwatukee),Sighted red to white horizontal line on the north west horizon. As the object got closer it looked like a 5 light triangle. It passed o,us,03/07/2018,600,33.44833,-112.07333,triangle,Pending,SS-7933
40-defiance-triangle,defiance,I was pulling out of a drive when I noticed a triangular craft with a light at each corner two white one blue I pulled over to get a be,us,11/01/2018,60,41.28444,-84.35583,triangle,Active,SS-8295
4105-gb-cylinder,glasgow (uk/scotland),2 craft - fast moving - strange design - unconventional motion - red light pulse mobilising the craft - would raf allow new jets in urb,gb,08/05/2019,180,55.83333,-4.25000,cylinder,Pending,SS-8755
410-phoenix (tempe)-light,phoenix (tempe),5 orange colored lights fall toward earth like fireworks.  Shortly after they hovered in place pulsating and began moving at odd traje,us,03/07/2018,420,33.44833,-112.07333,light,Pending,SS-7932
411-prescott-sleigh,prescott,Observed five yellow-white lights travelling from NW to NE then turning to S,us,03/07/2018,600,34.54000,-112.46778,sleigh,Pending,SS-7931
412-northwest tempe-Sleigh,northwest tempe,We saw 5 red lights in a V sleigh from the north to the south in a fifteen minute period.,us,03/07/2018,900,33.42551,-111.94000,Sleigh,Closed,SS-7930
4139-gb-Sleigh,derby (uk/england),My wife just happend to look up from watching T.V. and was engaged by the vividness of the colours.,gb,08/05/2019,0,53.16667,-1.58333,Sleigh,Closed,SS-8754
413-buckeye-sphere,buckeye,Observed a number (3 - 5) of white/yellow lights hovering (suspended) approximately 7 - 10 miles away.  Observed streaking object leavi,us,03/07/2018,300,33.37028,-112.58306,sphere,Active,SS-7929
414-mesa (at mesa community college)-triangle,mesa (at mesa community college),LARGE TRIANGULAR OBJECT WITH 5 DIM AMBER LIGHTS (ONE IN EACH CORNER AND 2 MORE NEAR FRONT) MOVED SLOWLY NW TO S-SW WITH NO NOISE.,us,03/07/2018,180,33.42222,-111.82194,triangle,Closed,SS-7928
415-prescott-Sleigh,prescott,Saw 5 bright lights in triangle sleigh in the northand heading southeast at an extremely fast speed.,us,03/07/2018,30,34.54000,-112.46778,Sleigh,Closed,SS-7927
416-tonopah-sphere,tonopah,I-10 W of Tonapah AZ and Highway 85 S I watched3 golf ball sized lights QQQ being observed by ajet (half the size of a tack head) 20:,us,03/07/2018,1500,33.49361,-112.93639,sphere,Pending,SS-7926
4172-au-circle,toowoomba  (australia),Blue pulsing light,au,06/06/2019,7200,-27.56056,151.95386,circle,Pending,SS-8999
4179-gb-triangle,falkirk (uk/england),On my way home one night i seen a triangular object 90-100 feet in the air - which i proceeded to follow,gb,06/06/2019,600,56.00000,-3.75000,triangle,Active,SS-8753
417-waterville-egg,waterville,i dont remember going to my room but when i woke up i went to the site at the end of the drive hidden by the high pile of snow and ther,us,03/07/2018,600,44.55194,-69.63222,egg,Pending,SS-7925
4181-gb-triangle,london (about 200 miles west of) (uk/england),Triangular object photographed out airplane window near London UK.,gb,06/06/2019,0,51.51412,-0.09369,triangle,Active,SS-8752
4185-gb-Sleigh,coventry (uk/england),Photographs of a strange sleigh the appears to be in the sky.,gb,06/06/2019,0,52.41667,-1.55000,Sleigh,Pending,SS-8751
418-oakton-delta,oakton,I saw two large bright round white lights moving forward together but keeping the same distance apart.  Then the two lights changed dir,us,03/07/2018,15,38.88083,-77.30111,delta,Pending,SS-7924
4192-de-light,koblenz (westerwald mountains near) (germany),they  couldn;t have been airplanes rockets meteors or something  since the objects moved much too fast and too irregularly (the obj,de,06/06/2019,0,50.88333,12.45000,light,Pending,SS-8796
419-aquaduct (near over desert before entering california)-triangle,aquaduct (near over desert before entering california),Flying Westward in a UAL plane over the desert near the aquaduct before entering CA another UAL plane approached and passed beneath us,us,03/07/2018,120,33.77078,-116.44514,triangle,Pending,SS-7923
41-deweyville-sphere,deweyville,My son and Iwere driving home going northbound along HWY39 we noticed a very bright large green sphericial object traveling east to no,us,11/01/2018,15,41.71056,-112.08944,sphere,Pending,SS-8296
4203-de-Sleigh,osnabruck (germany),craft flew over in sleigh of 20-30 craft.  fireballs  dropped from craft though not  from all craft.  All craft disappeared at a cer,de,06/06/2019,300,52.26667,8.05000,Sleigh,Pending,SS-8791
420-gothenburg (sweden)-sphere,gothenburg (sweden),Me and my vife was climbing in the mountain We stopd and lookd on a  flying object. it was Blue and it looked like a Ball.,us,03/07/2018,1500,0.00000,0.00000,sphere,Active,SS-7922
421-whitefish-light,whitefish,orange lights (not shaped likeaircraft) about 1000 feet overheadfollowed closely by jet (wingsvisible naked eye).  Only soundsof one ai,us,03/07/2018,10,48.41111,-114.33667,light,Closed,SS-7921
422-yucaipa-fireball,yucaipa,A single orange glowing object moving East at a steady speed.  Began to drop flaming objects like the shards from a welders torch.  Aft,us,03/07/2018,120,34.03361,-117.04222,fireball,Active,SS-7920
423-prairie du sac/merrimac ( between. on hwy. 78)-cross,prairie du sac/merrimac ( between. on hwy. 78),One small object with rotating lights then a little later a large brilliantly lit object in the shape of a cross with 4 bright lights,us,03/07/2018,600,43.29305,-89.73494,cross,Closed,SS-7919
424-bakersfield-light,bakersfield,Bright yellow light in the sky.  The brightest object in the sky.  Kept on brightening and lowering it flouresent yellow light.,us,03/07/2018,0,35.37333,-119.01778,light,Active,SS-7918
425-lake geneva-light,lake geneva,Near moon. small light (cover with thumb) camefrom Southeast at extremly fast speed. As itapproached approximate even with moon seemed,us,03/07/2018,600,42.59167,-88.43333,light,Pending,SS-7917
426-unadilla-light,unadilla,I have video of strange light in SE sky over central NY 21:30 est 03/22/97,us,03/07/2018,2,42.32528,-75.31278,light,Active,SS-7916
4276-gb-cigar,billingham (uk/england),driving to work i saw three lights in the skyone of them hovered above my car for 2 mins my car lost power the engine cut out i th,gb,06/06/2019,300,54.60000,-1.30000,cigar,Closed,SS-8750
427-stevens point-crescent,stevens point,A hazey orange object hovered in the evening sky.It moved in what looked like a crescent shapefrom the upper North-East to the North-,us,03/07/2018,37800,44.52361,-89.57444,crescent,Pending,SS-7915
4281-gb-light,leeds (uk/england),when i was 13 myself and my mother were looking at a car accident appox 200 yards from our address in seacroft leeds ukwe turned to co,gb,06/06/2019,10,53.80000,-1.58333,light,Active,SS-8749
428-snoqualmie-disk,snoqualmie,Disc shaped object with multiple colored lights hovered aprox 75 feet overhead. lights on bottom rotated to back. Lights flashing out o,us,03/07/2018,300,47.52889,-121.82417,disk,Active,SS-7914
4298-au-oval,sydney (nsw australia),silver football shaped object hovered above rooty hill seen by more than 50 people including me The Truth Is Out There,au,06/06/2019,600,-33.86148,151.20548,oval,Active,SS-8998
429-nederland-other,nederland,Group of Velebrators of Vernal Equinox are visited by dimmensional craft .Sunday evening a group gathered to welcome in the spring whi,us,03/07/2018,120,39.96139,-105.51028,other,Active,SS-7913
42-georgia (zip 30458)-Sleigh,georgia (zip 30458),Triangle shape Sleigh Moving slowly over house. Several red glowing lights underneath not blinking. Saw it thru the sunroof and went outsi,us,11/01/2018,0,32.16562,-82.90008,Sleigh,Pending,SS-8294
430-westminster-disk,westminster,A disc shaped object was floating above the color was a orangish red and glowing took off at a blink of an eye.My name is Dave an,us,03/07/2018,5,39.83667,-105.03667,disk,Active,SS-7912
431-manassas-sleigh,manassas,Seen 4 lights high speed very high altitudein the Manassas VA area.,us,03/07/2018,25,38.75083,-77.47556,sleigh,Active,SS-7911
432-owings mills-light,owings mills,Bright white object observed to the Westat about treetop level gained altitude andflew off silently,us,03/07/2018,300,39.41944,-76.78056,light,Active,SS-7910
433-huron-Sleigh,huron,2 Sleighs sited at 10:30 PM Eastern time comingfrom Canada over Huron Ohio moving at a veryfast rate of speed in unattached but similar,us,03/07/2018,3,41.39500,-82.55528,Sleigh,Pending,SS-7908
434-ann arbor-light,ann arbor,a red/orange flashing light that streaked aross the sky and took a 90 degree left turn.,us,03/07/2018,5,42.27083,-83.72639,light,Pending,SS-7909
435-williston-sphere,williston,I was standing out side looking at Hail-Bop when I saw a huge sphear of light fly about 50 ft. off the ground and burn a hole through,us,03/07/2018,120,29.38722,-82.44694,sphere,Closed,SS-7906
436-carlisle-sleigh,carlisle,An object that looked like a satillite suddenly became bright when we blinked a flashlight at it.It was joined by 7 others that flew i,us,03/07/2018,120,40.20139,-77.18917,sleigh,Pending,SS-7907
437-carmichaels-disk,carmichaels,Saw in clear skies long silver disc shapedobjecthigh in the sky. Flew over head of meand my witness. Object was silent had no visibl,us,03/07/2018,180,39.89667,-79.97472,disk,Pending,SS-7904
438-juneau-light,juneau,A friend and I saw a strange low altitudebright object flashing orange and greenrotating colors on Easter night in JuneauAlaska. When,us,03/07/2018,7200,58.30194,-134.41972,light,Closed,SS-7905
439-san francisco-oval,san francisco,2 small (about 1 ft. long &amp; 200 ft. away at closest) dark objects circling each other then sped southfollowed min. later by 2 more.,us,03/07/2018,120,37.77500,-122.41833,oval,Pending,SS-7903
43-tampa-Sleigh,tampa,The sleigh was roof high and I observed it very closely for at least 3 to 5 minutes,us,11/01/2018,1800,27.94722,-82.45861,Sleigh,Active,SS-8293
440-rohnert park (sonoma state university)-sphere,rohnert park (sonoma state university),I 1st noticed 3 small objects/stars/points excited state were Iscoceles  their locations from each other.  One then vanished two re,us,03/07/2018,10800,38.33972,-122.70000,sphere,Active,SS-7902
441-virginia beach-light,virginia beach,I was laying in my bed watching tv with the windows open and I saw this Bright yellow light fly across the sky then all of a suden It s,us,03/07/2018,2,36.85278,-75.97833,light,Active,SS-7901
442-seattle-flash,seattle,Less than a 1 second flash of large blue-white light climbing slightly on its path from west to east. .,us,03/07/2018,1,47.60639,-122.33083,flash,Pending,SS-7900
443-east detroit (eastpoint0-Sleigh,east detroit (eastpoint0,I called my name is Jim Asaro.Me and 3 friends went out to go to somones house we looked at the sky we saw a Sleigh it had four lights in,us,03/07/2018,0,42.46509,-82.92461,Sleigh,Pending,SS-7899
444-tompson-light,tompson,At around 1:30 am. we saw a light searching the top of the trees.We discounted it as a hellicopter of poachers.After aboout an hourhou,us,03/07/2018,14400,33.47069,-82.50457,light,Active,SS-7898
445-atlantic ocean-light,atlantic ocean,During a flight from Boston to Amsterdam a strange point of light could be seen for almost the whole flight.,us,03/07/2018,14400,-14.59941,-28.67315,light,Pending,SS-7897
446-houma-Sleigh,houma,The sleigh was roof high and I observed it very closely for at least 3 to 5 minutes,us,03/07/2018,10,29.59556,-90.71944,Sleigh,Active,SS-7896
447-indiana-Sleigh,indiana,we saw a sleigh shaped object with a halo around it behind it followed three jets with after burners engaged colors appeared to be blue,us,03/07/2018,10,40.62139,-79.15278,Sleigh,Closed,SS-7895
448-monrovia-sleigh,monrovia,Three (3)objects flying over Monrovia,us,03/07/2018,60,34.14806,-117.99806,sleigh,Active,SS-7893
4497-au-other,shepparton (vic australia),3 box shaped object appeared for about 10 seconds and then disappeared as if they teleported,au,03/07/2019,10,-36.38047,145.39867,other,Active,SS-8997
449-punta arenas (chile)-Sleigh,punta arenas (chile),Sleigh watched over Punta Arenas Chile on april 15th. 1997.,us,03/07/2018,210,0.00000,0.00000,Sleigh,Active,SS-7894
44-moorpark-oval,moorpark,Oval shaped metallic rotating object with blinking lights. At first sighting it was rotating above a house then zoomed in closer to me.,us,11/01/2018,600,34.28556,-118.88111,oval,Active,SS-8292
450-bakersfield-light,bakersfield,I was looking up at the sky for Hale-Bopwhen from the south a round yellowish light zoomed across the sky at a very high speed.,us,03/07/2018,2,35.37333,-119.01778,light,Pending,SS-7891
451-west memphis-light,west memphis,Two lights merge together due south thenproceed rapidly to the southwest where theydisappear at the horizon,us,03/07/2018,60,35.14953,-90.04898,light,Closed,SS-7892
452-dallas-diamond,dallas,Looking East saw bright red light descendingdown thru cloud layer then back up into cloudsrepeating twice. Red light had a diamond s,us,03/07/2018,900,32.78333,-96.80000,diamond,Closed,SS-7889
453-suisun (north s.f. bay area)-Sleigh,suisun (north s.f. bay area),The sleigh was roof high and I observed it very closely for at least 3 to 5 minutes,us,03/07/2018,2700,0.00000,0.00000,Sleigh,Closed,SS-7890
4541-gb-diamond,newport (uk/england),Diamond Transparent destorting background stars.,gb,12/09/2019,3,52.01667,-4.83333,diamond,Pending,SS-8748
454-greentown-Sleigh,greentown,4 Sleighs spotted In Northwest Sky near the Big Dipper constellation. They all moved in roughly the same direction.(N-NE),us,03/07/2018,1200,40.47806,-85.96667,Sleigh,Active,SS-7887
455-lebanon-sphere,lebanon,A giant red ball of light( about 5 time the size hale-bopp was)flew across the sky at well over 1000MPH.,us,03/07/2018,2,37.68056,-92.66361,sphere,Pending,SS-7888
456-worcester-egg,worcester,It was a bright white/Yellow light moving at an incredible speed.  Too fast for any plane Went from west to East The White light woul,us,03/07/2018,30,42.26250,-71.80278,egg,Active,SS-7885
457-spokane-light,spokane,Large bright red light size of Venus at its brightest observed over Spokane Wa. at 1:00 a.m. on April 22 for about 20 minutes. Appe,us,03/07/2018,1200,47.65889,-117.42500,light,Active,SS-7886
4581-gb-cigar,new forest (uk/england),it was flying low hovering at first the moving off slowly before it dissaperd,gb,12/09/2019,60,50.83333,-1.60000,cigar,Active,SS-8747
458-new brighton-triangle,new brighton,20-35 triangular shaped craft sighting.Bright flashing lights at corners.,us,03/07/2018,2700,45.06556,-93.20167,triangle,Active,SS-7884
4596-au-rectangle,perth (western australia),craft sucks water out of pool in australia,au,12/09/2019,600,-31.95224,115.86140,rectangle,Pending,SS-8995
459-port wentworth-other,port wentworth,object travelled at approx 800feet. moving north to south over savannah international airport at about 500 mph. no engine noise or exha,us,03/07/2018,300,32.14889,-81.16333,other,Active,SS-7883
45-columbia-Sleigh,columbia,U-shaped sleigh of orange gold lights travelling south at high speed.,us,11/01/2018,6,35.61500,-87.03528,Sleigh,Pending,SS-8290
4607-gb-sphere,penryn (uk/england),Mir incident,gb,12/09/2019,120,50.16667,-5.10000,sphere,Active,SS-8746
460-au-egg,melbourne (vic australia),At aprox. 20.45 I noticed 2 light emitting pinkish egg shaped objects n/w of my position. They were aprox 50 miles away travelling extr,au,03/07/2018,10,-37.81394,144.96342,egg,Pending,SS-9018
461-randle (near)-light,randle (near),Large bright object moving horizontal in the evening sky very low made no noise.,us,03/07/2018,45,46.53528,-121.95583,light,Active,SS-7882
4622-gb-light,london (uk/england),A simple pulsating light in an occean of blue,gb,12/09/2019,90,51.51412,-0.09369,light,Pending,SS-8745
462-colorado springs-cylinder,colorado springs,Dark.  Between Fontaine and Drennan Rd. A tall brightly litobject descended in field near reservoir west of Powers Rd.  Tieredwith mul,us,03/07/2018,300,38.83389,-104.82083,cylinder,Closed,SS-7881
463-west reno (out on old hwy 40)-other,west reno (out on old hwy 40),Loud boom so loud shook house. Went outside to see what happened. Saw hole in sky cover perfect circle. Moon in center of circlefull,us,03/07/2018,60,39.52972,-119.81278,other,Pending,SS-7880
464-central texas-light,central texas,Mother relates story of helicopters observing circle of blue lights on ground.My mother told me this story a few years ago and I ju,us,03/07/2018,0,31.37732,-97.06698,light,Active,SS-7879
465-fallon-light,fallon,USN trained weather observer sighted 3 solid colored lights two red one white moving south to north silently and periodicallyrock,us,03/07/2018,45,39.47361,-118.77639,light,Pending,SS-7877
466-elmer-other,elmer,I was on the way home from my girl friends house at around 900 pm and as i passed by   centerton lake i witnesed a huge object sitting,us,03/07/2018,600,39.59500,-75.17056,other,Closed,SS-7878
