Name,City,Comments,Country,Date Posted,Duration,Lat,Long,Shape,SS Status,Unique ID
14233-gb-chevron,gillingham (uk/england),Watching Discovery Science on TV about the Pheonix lights brought to memory an event that happened to me in I think 1970 in either Sept,gb,02/08/2005,0,51.40000,0.56667,chevron,Active,SS-8432
14296-gb-fireball,nottinghamshire (uk/england),fire ball shape object seen in nottinghamshire  time was 22.35 heading south west at speed,gb,11/08/2005,3,53.16667,-1.00000,fireball,Pending,SS-8424
142-des moines-sphere,des moines,Multi-colored sphere shaped object observed in western sky for approx. 30 minutes the first 15 minutes or so in a stationary position.,us,11/01/2018,1800,47.40194,-122.32306,sphere,Active,SS-8192
14334-gb-circle,storrington (uk/england),Two circular objects flew over south of UK high speed high velocity and converging courses.,gb,11/08/2005,8,50.90000,-0.45000,circle,Pending,SS-8430
14340-gb-circle,london (mad mile rd. addington) (uk/england),V.fast &amp;bright white &amp; red lights. 4 disc shaped feet things for it to land. Oval and rectangler at different angles.No noise.Very Low,gb,11/08/2005,1800,51.51412,-0.09369,circle,Active,SS-8422
14359-gb-sphere,waltham abbey (uk/england),hi we let off fireworks to see in the new year as the last one was finishing we noticed three circles of light in a tri-angular forma,gb,01/11/2005,360,51.68333,0.01667,sphere,Active,SS-8428
143-rushville-Sleigh,rushville,TWO BRIGHT ORANGE LIGHTS SIDE BY SIDE AND TWO BRIGHT YELLOW LIGHTS ON THE OUTSIDE OF THEM,us,11/01/2018,300,40.12111,-90.56306,Sleigh,Active,SS-8195
14416-gb-light,brighton (uk/england),A bright light hovered some distance away for a minute before bursting into 4 or 5 lights and all of them disappearing.,gb,01/11/2005,60,50.83333,-0.15000,light,Closed,SS-8420
14437-gb-flash,birmingham (uk/england),3 white lights flash downward within about 0.3 seconds,gb,01/11/2005,3,52.46667,-1.91667,flash,Active,SS-8426
14439-gb-cigar,oxford (uk/england),silver sparkly object splits into two,gb,01/11/2005,240,51.75000,-1.25000,cigar,Active,SS-8425
14475-gb-cone,dunstable (uk/england),Cone shaped object,gb,01/11/2005,900,51.88333,-0.51667,cone,Active,SS-8418
14491-gb-light,kidderminster (uk/england),2 orange lights making sudden manouvres in the sky seperating and rejoining.,gb,01/11/2005,360,52.38333,-2.25000,light,Active,SS-8423
144-gobles-disk,gobles,4 disks looked as if they were playing a game of chicken in the sky above a lake.,us,11/01/2018,180,42.36083,-85.87944,disk,Active,SS-8190
14560-gb-Sleigh,folkestone (uk/england),sleigh shaped object flying slowly and silently with coloured lights moved towards the bright light. I signalled to it,gb,05/11/2005,3600,51.08333,1.18333,Sleigh,Active,SS-8415
14598-gb-triangle,manchester (uk/england),Large Black Triangle with three Red Lights at each corner about 500 Meters big flew at about 100Feet,gb,05/11/2005,8,53.50000,-2.21667,triangle,Active,SS-8421
145-woodbridge-triangle,woodbridge,Went out to see the ring around the moonwhen I saw strange light in the sky. As it got closer noticed it was a triangular craft with a,us,11/01/2018,0,38.65806,-77.25000,triangle,Pending,SS-8193
14631-gb-sleigh,edinburgh (uk/scotland),2:45 am We observed three white lights very high moving quite fast towards the south.,gb,05/11/2005,180,55.83333,-3.08333,sleigh,Active,SS-8413
14659-gb-circle,distington (uk/england),BALL OF FIRE,gb,05/11/2005,2,54.58333,-3.53333,circle,Active,SS-8419
14670-gb-circle,newbury (uk/england),craft with 4 lights wooooooood over the skies nearby,gb,05/11/2005,10,51.40000,-1.31667,circle,Pending,SS-8411
14671-gb-oval,aylesbury (uk/england),Green glowing meteor-like object streaks across sky and disappears behind tree-line,gb,05/11/2005,10,51.81667,-0.80000,oval,Active,SS-8417
146-torrance-egg,torrance,egg shaped reflected the sun.,us,11/01/2018,120,33.83583,-118.33972,egg,Active,SS-8188
14774-gb-Sleigh,london (uk/england),Circle shaped object silently flew over I would of guessed it was sleigh shaped if I had seen it from another angle.,gb,05/11/2005,5,51.51412,-0.09369,Sleigh,Closed,SS-8409
147-salem-Sleigh,salem,The sleigh was roof high and I observed it very closely for at least 3 to 5 minutes,us,11/01/2018,45,44.94306,-123.03389,Sleigh,Active,SS-8191
14821-gb-fireball,glasgow (uk/scotland)),Large fireball falling through sky at night.,gb,05/11/2005,60,55.83333,-4.25000,fireball,Active,SS-8416
14856-gb-light,berkshire county (uk/england),Several Strange Lights All Spaced Out Evenly In A 5 Mile Radius,gb,05/11/2005,1200,51.50000,-1.25000,light,Pending,SS-8414
14868-gb-other,glasgow (uk/scotland),Moving star,gb,05/11/2005,600,55.83333,-4.25000,other,Active,SS-8406
148-osceola-light,osceola,5 bright orange lights in a line going up the western horizon slowly moving up the sky quite spaced apart.  2 of them seem to have ex,us,11/01/2018,300,41.66500,-86.07583,light,Closed,SS-8186
14900-gb-Sleigh,croydon (uk/england),Moving star withiut sound which then vanished for no reason.  ((Sleigh Note:  Possible satellite?  PD)),gb,05/11/2005,120,51.38333,-0.10000,Sleigh,Pending,SS-8412
14907-gb-light,barnsley (uk/england),scared the poo out of my cat.........and me........,gb,05/11/2005,30,51.73333,-1.88333,light,Active,SS-8404
14968-gb-triangle,wakefield (uk/england),me and my cousen were walking home from a fishshop when we stopped to look at what we assumed to b some srt of shooting star. seconds l,gb,05/11/2005,180,53.70000,-1.48333,triangle,Pending,SS-8410
14977-gb-cylinder,hartlepool (uk/england),Cylindrical object performing complex maneuvers then accelerating at great speed out of my sight.,gb,05/11/2005,120,54.68611,-1.21250,cylinder,Pending,SS-8402
14981-gb-Sleigh,london (uk/england),3 bright red dancing lights,gb,05/11/2005,60,51.51412,-0.09369,Sleigh,Active,SS-8408
149-telluride-light,telluride,Similar to report from Longmont CO on 9/7/98.Very fast moving light,us,11/01/2018,3,37.93750,-107.81167,light,Active,SS-8189
14-manchester-oval,manchester,hovering above city landfill.  beam of light from craft to ground.,us,11/01/2018,120,42.99556,-71.45528,oval,Closed,SS-8324
15037-gb-cigar,nottingham (uk/england),Summer 1984 Cigar Shaped Craft seen in Nottingham U.K.,gb,05/11/2005,300,52.96667,-1.16667,cigar,Pending,SS-8407
150-landover (raljon)-diamond,landover (raljon),Sitting in the end zone at Jack Kent Cooke stadium over my right shoulder noticed dark diamond with rounded corners come up over the,us,11/01/2018,20,38.93389,-76.89694,diamond,Pending,SS-8187
15117-gb-light,buxton (uk/england),3 satellite looking objects moving close together,gb,10/11/2005,240,52.75000,1.30000,light,Active,SS-8399
151-mariposa-fireball,mariposa,Observed a light behind a tree that was bright white then it took off and as it did it turned brillaint green,us,11/01/2018,5,37.48500,-119.96528,fireball,Closed,SS-8184
15214-gb-circle,arbroath (uk/scotland),white lighted circular craft that moved at speed and was behind clouds,gb,10/11/2005,600,56.55000,-2.58333,circle,Active,SS-8405
15233-gb-light,falkirk (uk/scotland),stange long light in a vertical position hi in the sky,gb,10/11/2005,30,56.00000,-3.75000,light,Pending,SS-8397
15237-gb-disk,london (uk/london),I have this craft on tape IF YOU WISH TO HAVE A COPY OF IT,gb,10/11/2005,240,51.51412,-0.09369,disk,Pending,SS-8403
15244-gb-triangle,swindon (uk/england),As above,gb,10/11/2005,0,51.51667,-1.78333,triangle,Closed,SS-8395
15258-gb-sphere,coventry (uk/england),Two spherical flashing objects over Coventry UK,gb,10/11/2005,1800,52.41667,-1.55000,sphere,Active,SS-8401
15265-gb-disk,shoreham-by-sea (uk/england),Well we saw a bright light with a disk shape underneath. And then a ladder seemed to be coming out but then went back inside the craft,gb,10/11/2005,60,50.83333,-0.23333,disk,Closed,SS-8393
15267-gb-light,london (northwest) (uk/england),Object dissappeared into what may have been outer space.,gb,10/11/2005,25,51.51412,-0.09369,light,Closed,SS-8400
152-waterford-fireball,waterford,Stargazing on my deck and sighted what I thought at the time was a large green meteor (Largest I ever seen),us,11/01/2018,10,42.70222,-83.40278,fireball,Active,SS-8185
15390-gb-disk,wakefield (uk/england),silver disc very high up in the sky west yorkshire england,gb,10/11/2005,300,53.70000,-1.48333,disk,Active,SS-8398
153-oregon-fireball,oregon,Bright Orange Fireball appeared in SW sky. Traveled slowly at about 30degrees across the southern sky toward the east. No sound long t,us,11/01/2018,120,41.64361,-83.48694,fireball,Pending,SS-8182
15401-gb-Sleigh,derby (uk/england),High spead Sleigh sigting.,gb,10/11/2005,30,53.16667,-1.58333,Sleigh,Active,SS-8392
15410-gb-sphere,doncaster (south yorkshire) (uk/england),I saw a light in the sky with a smaller light orbiting it moving strangely.,gb,10/11/2005,600,53.53333,-1.11667,sphere,Pending,SS-8396
15422-gb-disk,mansfield (uk/england),Scary.,gb,10/11/2005,300,53.13333,-1.20000,disk,Pending,SS-8390
15425-gb-Sleigh,broadway (uk/england),bright red lights and fast,gb,10/11/2005,2,51.76472,-4.47278,Sleigh,Active,SS-8394
15453-gb-other,harrow on the hill (uk/england),Silver dome shape object,gb,10/11/2005,0,51.56667,-0.33333,other,Pending,SS-8388
15456-gb-circle,essex (uk/england),ball of orange light moving and disappearing then reappearing.,gb,10/11/2005,600,51.83333,0.58333,circle,Pending,SS-8391
15458-gb-triangle,london (uk/england),3 stars moving in the shape of a triangle,gb,10/11/2005,60,51.51412,-0.09369,triangle,Active,SS-8389
15463-gb-chevron,coventry (uk/england),large arrow-shaped craft over Coventry UK,gb,10/11/2005,10,52.41667,-1.55000,chevron,Active,SS-8386
15466-gb-Sleigh,plymouth (uk/england),i have video of a type of orb like light on my mobile do you have a number i can send it on too,gb,10/11/2005,60,50.39639,-4.13861,Sleigh,Pending,SS-8387
15471-gb-circle,london (uk/england),i saw a helecopter and plane then three round balls around the plane in a v formaton,gb,10/11/2005,60,51.51412,-0.09369,circle,Active,SS-8384
154-san diego-sphere,san diego,From the south a somewhat dim yellow/green/orange sphere floated up and to the north from behind some trees. It then almost stopped and,us,11/01/2018,300,32.71528,-117.15639,sphere,Pending,SS-8183
155-minneapolis-sphere,minneapolis,Object just sat in the air glowing brightly then dimmed.  There seemed to be no pattern to it.,us,11/01/2018,60,44.98000,-93.26361,sphere,Active,SS-8179
156-mt. vernon-fireball,mt. vernon,Bright Blue (as that of an arc welder) light that lit up entire landscape. It was 1/4 dia of moon (in arc seconds),us,11/01/2018,5,44.41765,-119.11357,fireball,Active,SS-8181
15707-gb-Sleigh,nottingham (uk/england),Sleigh sighting Nottingham England.Bright light eventually appeared to grow and change shape b4 vanishing,gb,10/11/2005,180,52.96667,-1.16667,Sleigh,Pending,SS-8385
157-frances-fireball,frances,green fireball seen falling in an arc toward LongviewWA and appear to hit the ground with 3 flashes,us,11/01/2018,2,46.54250,-123.50361,fireball,Active,SS-8177
15817-gb-light,fife (uk/england),reflected cloud white glowing lights randomly apearing and spinning around a center piont and reversing,gb,10/11/2005,18000,56.25000,-3.16667,light,Active,SS-8382
158-san francisco-diamond,san francisco,3 diamond shaped craft with 4 bright lights hovered on the eastern sky.,us,11/01/2018,2700,37.77500,-122.41833,diamond,Active,SS-8180
15951-gb-light,doncaster (uk/england),fast moving red ball of light.,gb,12/07/2006,0,53.53333,-1.11667,light,Pending,SS-8383
15988-gb-light,doncaster (uk/england),Balls of light apearing zig zagging up and down growing shrinking and then disapearing.,gb,12/07/2006,0,53.53333,-1.11667,light,Active,SS-8379
15992-gb-cigar,london (uk/england),5 cigar shaped objects dancing over the london area,gb,12/07/2006,0,51.51412,-0.09369,cigar,Active,SS-8381
159-west salem-changing,west salem,It had approx. 4 large lights in a diamond shape that would blink and immediately following it a large burst of fire from the rear..,us,11/01/2018,60,40.90083,-80.85694,changing,Pending,SS-8175
15-mt sterling-Sleigh,mt sterling,3 orange fireballs in triangle sleigh - 1 triangle shaped craft without sound.,us,11/01/2018,900,39.98727,-90.76346,Sleigh,Closed,SS-8319
16032-gb-circle,trowbridge (uk/england),U.F.O.sighting in Wiltshire,gb,12/07/2006,600,51.31889,-2.20861,circle,Active,SS-8377
16052-gb-Sleigh,brighton (uk/england),Four bright lights in a loose sleigh,gb,12/07/2006,300,50.83333,-0.15000,Sleigh,Active,SS-8380
16078-gb-other,newmarket (uk/england),strange interference,gb,12/07/2006,30,53.30000,-3.38333,other,Closed,SS-8378
160-rock valley-Sleigh,rock valley,I was out stargazing and a large completely silent triangle Sleigh passed overhead at phenomenal speed towards the East. Two more went ov,us,11/01/2018,3600,43.20528,-96.29472,Sleigh,Closed,SS-8178
16106-gb-sphere,newcastle (uk/england),Diamond shape in Sky,gb,12/07/2006,30,54.20000,-5.88333,sphere,Closed,SS-8375
16114-gb-light,kirkcaldy (uk/scotland),long white line like shooting star but slow and thicker and same shape viewed from kirkcaldy scotland,gb,12/07/2006,3600,56.11667,-3.16667,light,Pending,SS-8376
16119-gb-flash,london (uk/england),Intense light over East London 24th Novemeber 06,gb,12/07/2006,2,51.51412,-0.09369,flash,Pending,SS-8373
16125-gb-disk,norwich (norfold) (uk/england),the 3 discs travelled in a circle and turned to sparks,gb,12/07/2006,90,52.63333,1.30000,disk,Active,SS-8374
16128-gb-flash,nottingham (uk/england),Flashes Over Nottingham,gb,12/07/2006,60,52.96667,-1.16667,flash,Active,SS-8371
16135-gb-triangle,stevenage (uk/england),Mazing,gb,12/07/2006,240,51.91667,-0.21667,triangle,Pending,SS-8372
16145-gb-cigar,llandudno (uk/wales),silver cigar shaped craft daylight llanduno north wales,gb,12/07/2006,60,53.33333,-3.83333,cigar,Active,SS-8370
161-tucson-Sleigh,tucson,Pair of objects flying side by side.,us,11/01/2018,60,32.22167,-110.92583,Sleigh,Active,SS-8172
16222-gb-Sleigh,swindon (uk/england),a POSSIBLE major Sleigh sighting in the Swindon area of wiltshire UK,gb,12/07/2006,14400,51.51667,-1.78333,Sleigh,Pending,SS-8369
16223-gb-cigar,swindon (uk/england),A shocking and unexplainable sighting - perhaps a major sighting event.,gb,12/07/2006,14400,51.51667,-1.78333,cigar,Closed,SS-8368
16224-gb-light,grimsby (uk/england),Driving back from a fireworks display along the A16 which is a poorly lit road saw 3 objects which looked like candle flames globula,gb,12/07/2006,300,53.53333,-0.05000,light,Closed,SS-8367
16225-gb-triangle,swindon (uk/england),3 reddish/orange diffused lights in the configuaration of an imperial star destroyer,gb,12/07/2006,30,51.51667,-1.78333,triangle,Active,SS-8366
16228-gb-light,coventry (uk/england),Seven orange lights following each other,gb,12/07/2006,240,52.41667,-1.55000,light,Active,SS-8365
16229-gb-Sleigh,coventry (uk/england),line of light Sleigh,gb,12/07/2006,300,52.41667,-1.55000,Sleigh,Pending,SS-8363
16237-gb-light,chesterfield (uk england),2 amber coloured lights sighted over claycross in the east midlands in england,gb,12/07/2006,600,53.25000,-1.41667,light,Pending,SS-8364
162-east machias-light,east machias,Light in sky got brighter and truck almost stalled out light flickered out.,us,11/01/2018,60,44.73917,-67.39056,light,Pending,SS-8176
16321-gb-egg,hull (uk/england),SMALL OBJECT DARK GREY TO BLACK APPROX 18 - 24 INCHES ACROSS ABOUT 12 INCHES IN HEIGHT WAS STATIONARY AT ABOUT 40 FEET IN THE AIR S,gb,12/07/2006,1200,53.71667,-0.33333,egg,Pending,SS-8361
16361-gb-oval,london (uk/england),AT NIGHT APPROXIMATELY 20-25 OVAL SHAPED ORANGE OBJECTS FLEW ACROSS THE SKY SLOWLY STOPPED FOR ABOUT 1 MINUTE BEFORE FLYING SOUTH AN,gb,12/07/2006,180,51.51412,-0.09369,oval,Active,SS-8362
16363-gb-light,east preston (uk/england),ERRATIC LIGHT SEEN OVER GATWICK AIRPORT 4/12/2006,gb,12/07/2006,120,50.78333,-0.46667,light,Active,SS-8358
16367-gb-light,london (uk/england),7 bright red lights hovering and then shooting upwards into space at an alarming rate,gb,12/07/2006,1200,51.51412,-0.09369,light,Active,SS-8360
16368-gb-Sleigh,sedgley (west midlands) (uk/england),Mysterious Mi-8 helicopter and crop circles in Sedgley West Midlands early 1990s.,gb,12/07/2006,0,52.53333,-2.11667,Sleigh,Active,SS-8356
16386-gb-circle,london ((uk/england),please understand that what i saw was many years ago. i was about 17 years of age at the time when i looked out of the kitchen window a,gb,12/07/2006,15,51.51412,-0.09369,circle,Closed,SS-8359
16397-gb-triangle,derbyshire (uk/england),not sure entirely of year it was but it was a clear blue sky day and i was about 13 me and my playmate were sitting on a haystack and i,gb,12/07/2006,180,53.16667,-1.58333,triangle,Active,SS-8354
163-albany-Sleigh,albany,The sleigh was roof high and I observed it very closely for at least 3 to 5 minutes,us,11/01/2018,45,44.63667,-123.10472,Sleigh,Active,SS-8170
16416-gb-Sleigh,cumbria (uk/england),A silver shaped object went down out of sight and what came into vision a second later was two orange light/objects flying skywards.,gb,12/07/2006,60,54.58333,-2.83333,Sleigh,Pending,SS-8357
16464-gb-other,motherwell (uk/england),SAW  TWO BRIGHT ORANGE SHAPES WHICH LATER JOINED CREATING A HALF MOON SHAPE.,gb,12/07/2006,480,55.78333,-4.00000,other,Active,SS-8352
16467-gb-Sleigh,kirkby (merseyside) (uk/england),WHILE TRAWLING THROUGH Sleigh WEB SITES I CAME ACROSS A REPORT WHICH OCCURED ON SEPTEMBER 8 1970IT INVOLVED A LIGHTNING JET THAT WAS SCRA,gb,12/07/2006,120,53.08333,-1.26667,Sleigh,Active,SS-8355
16474-gb-cigar,castleside (uk/england),I saw a huge cigar shaped object pulsating red then orange like a heartbeat my horse saw it first.,gb,03/11/2006,300,54.83333,-1.86667,cigar,Active,SS-8353
164-lenoir city-other,lenoir city,I was riding in a boat and noticed a very bright pair of lights at about 30 degrees above the horizon I turned to ask my wife if she sa,us,11/01/2018,60,35.79722,-84.25611,other,Active,SS-8174
16526-gb-sphere,lancashire (uk/england),Bright orange light with flame behind it flying across the sky,gb,03/11/2006,120,53.88900,-2.63378,sphere,Active,SS-8350
16548-gb-light,great yarmouth (uk/england),was walking too work when i noticed a really brite light in the sky at first i thought it may have been the planet you can see in the e,gb,03/11/2006,120,52.63333,1.75000,light,Pending,SS-8351
16569-gb-light,london (uk/england),Huge section of sky filled with burning purple/orange colour over london,gb,03/11/2006,5,51.51412,-0.09369,light,Closed,SS-8348
16580-gb-Sleigh,sheffield (uk/england),a bright orange/yellow orb flashed through the sky with heavy cloud sleigh not a shooting star and way too fast for a plane light i,gb,03/11/2006,5,53.36667,-1.50000,Sleigh,Active,SS-8349
165-bonmahon (county waterford (republic of ireland)-fireball,bonmahon (county waterford (republic of ireland),we stood on a cliff and watched the skies when a blue fireball crossed the skies at a very high speed.  This was seen again 3 days late,us,11/01/2018,3,51.89118,-8.45862,fireball,Active,SS-8168
16619-gb-Sleigh,somerset (uk/england),We saw a Sleigh in Bridgwater Somerset UK,gb,03/11/2006,15,51.08333,-3.00000,Sleigh,Pending,SS-8346
16626-gb-sleigh,oxford (uk/england),6 craft red /dark brown colour  no noice,gb,03/11/2006,2040,51.75000,-1.25000,sleigh,Active,SS-8347
16676-gb-circle,bognor regis (uk/england),Objects in sky not planes too high 4 or 5 communicating.,gb,03/11/2006,10,50.78333,-0.65000,circle,Pending,SS-8345
16680-gb-Sleigh,canterbury (near) dover kent (uk/england),100mw Red pulsar laser chased off  Sleigh.,gb,03/11/2006,40,51.26667,1.08333,Sleigh,Active,SS-8342
16689-gb-other,birmingham (uk/england),Looking through my kitchen window I can see several horizontal white lines appearing in the sky all travelling in the same path. Tho,gb,03/11/2006,900,52.46667,-1.91667,other,Pending,SS-8344
166-san leandro-Sleigh,san leandro,The sleigh was roof high and I observed it very closely for at least 3 to 5 minutes,us,11/01/2018,0,37.72500,-122.15500,Sleigh,Pending,SS-8173
16730-gb-triangle,dumfries (uk/england),i remember it well when i was out side in my back garden i saw this light it was coming from the sky so i looked up it was this huge tr,gb,03/11/2006,0,55.06667,-3.55000,triangle,Pending,SS-8341
16771-gb-teardrop,middlesbrough (uk/england),bright teardrop descending,gb,03/11/2006,600,54.57278,-1.16278,teardrop,Closed,SS-8343
16780-gb-disk,cardiff (uk/wales),back in 1974 I was 19 at the time and  lived in a suburb of Cardiff Wales UK called Ely and in the distance there was a wood called Ca,gb,02/01/2007,1200,51.50000,-3.20000,disk,Pending,SS-8338
167-singapore-other,singapore,I were on the express way when i saw an object in the sky about 200meter far looks like the Stealth floating in the sky. Many people ha,us,11/01/2018,600,1.35208,103.81984,other,Pending,SS-8166
16895-gb-oval,welwyn garden city (uk/england),4 Red lights seen over Welwyn Garden City in Hertfordshire England,gb,02/01/2007,600,51.80000,-0.20000,oval,Pending,SS-8340
168-lompoc-Sleigh,lompoc,The sleigh was roof high and I observed it very closely for at least 3 to 5 minutes,us,11/01/2018,0,34.63917,-120.45694,Sleigh,Closed,SS-8171
169-grayling-sphere,grayling,Brownish orange large lights. a smaller  same colored light came out from under one of the lights. Lights would blink out then reappe,us,11/01/2018,1800,44.66139,-84.71472,sphere,Active,SS-8164
16-ipava-triangle,ipava,An object which resmbled car headlights in the sky was spotted to SW.  A discernable craft flew directly overhead and proceeded to disa,us,11/01/2018,900,40.35139,-90.32444,triangle,Pending,SS-8322
17009-gb-Sleigh,durham (uk/england),I saw a Sleigh and it was circle shaped and its colour was like a purple. It left a small trail. It also had flashing lights all over it a,gb,02/01/2007,120,54.76667,-1.56667,Sleigh,Active,SS-8336
17018-gb-circle,ramsey (isle of man) (uk/england),Round green flashing object,gb,02/01/2007,60,51.93333,1.21667,circle,Active,SS-8339
17032-gb-other,accrington (uk/england),Strange aircraft in sky over Lancashire,gb,02/01/2007,600,53.76667,-2.35000,other,Active,SS-8334
170-nome-light,nome,my brother and i witness a green light and followed it on foot and the craft was moving at great speed to 1 end of the town to the next,us,11/01/2018,0,46.67778,-97.81000,light,Active,SS-8169
171-portland-light,portland,Very high altitude small light appeared to be a star. moved from west to east when overhead turned 90 degrees to the north.,us,11/01/2018,20,45.52361,-122.67500,light,Active,SS-8167
172-mt. baker-oval,mt. baker,http://www.geocities.com/Area51/Nebula/2300/baker.html   Was seen by 10-14 people clearly for 5-10 seconds. Object was in a flat horizo,us,11/01/2018,10,48.77734,-121.81320,oval,Closed,SS-8162
173-grants pass (murphy area)-fireball,grants pass (murphy area),Flying from the South going North East.  The green fireball with barely a tail came between two trees on the land behind our home and,us,11/01/2018,3,42.43917,-123.32722,fireball,Active,SS-8165
174-battle mountain-disk,battle mountain,Full moon or just after (that time) 8 to 8-30 pm. Two seperate occasions the first a month earlier. Disc shaped no lights featureles,us,11/01/2018,300,40.64222,-116.93333,disk,Pending,SS-8160
175-randle/packwood (between)-Sleigh,randle/packwood (between),The sleigh was roof high and I observed it very closely for at least 3 to 5 minutes,us,11/01/2018,10,46.60650,-121.67064,Sleigh,Active,SS-8163
176-puyallup-fireball,puyallup,A bluish/gree fireball (size of a large grape - with arm extended) and a long white tail trailing behind as it arched over the Puyallup,us,11/01/2018,5,47.18556,-122.29167,fireball,Pending,SS-8158
177-del mar-fireball,del mar,This was like a green colored light like a star.  It was lower than any other aircraft would be.  It was decending in an easterly dir,us,11/01/2018,60,32.95944,-117.26444,fireball,Closed,SS-8161
178-castaic-fireball,castaic,Traveling north on I-5 in Castaic seen a greenish-white brilliantly lit fireball. Perfectly round in size come out of the sky at a do,us,11/01/2018,2,34.48889,-118.62194,fireball,Active,SS-8155
179-scottsdale-disk,scottsdale,iT looked like a big star twinkling.Thru binaculars it had red green and white lites blinking like a disco lite.  In the distance wher,us,11/01/2018,0,33.50917,-111.89833,disk,Active,SS-8159
17-lincoln-Sleigh,lincoln,3 Lights not as egg shaped but close thumb nail. Flying in tryangle sleigh flew over for 7 seconds not to close but not far away. f,us,11/01/2018,11,40.80000,-96.66667,Sleigh,Active,SS-8317
180-seattle-disk,seattle,Disk hovered over highway,us,11/01/2018,900,47.60639,-122.33083,disk,Active,SS-8153
181-seattle-egg,seattle,The craft had about 6 white lights around its perimeter and a redish one in the middle. The thing was moving slowly towards the west,us,11/01/2018,180,47.60639,-122.33083,egg,Pending,SS-8157
182-las vegas-other,las vegas,Driving to work. Green Bright light caught my eye going from northwest to south east. My daughter spotted it at the same time. It was b,us,11/01/2018,10,36.17500,-115.13639,other,Active,SS-8151
1837-ca-triangle,scarborough (canada),Mom &amp; 3 daughters see rounded triangular obj. w/ approx. 20 lights on leading edge streak overhead to S. Bigger than fist overhead.,ca,11/02/2019,30,43.75000,-79.20000,triangle,Pending,SS-8969
183-bodie (state historic park)-sphere,bodie (state historic park),I saw a spherical object traveling east to west at 3PM. It appeared to change from white to black to silver and flew below the clouds.;,us,11/01/2018,120,38.21222,-119.01111,sphere,Pending,SS-8156
184-redding-light,redding,Witnessing bright lights mostly white with green and red in the sky at every point on the compass starting at 7:00PM and lasting unt,us,11/01/2018,0,40.58667,-122.39056,light,Pending,SS-8154
