Name,City,Comments,Country,Date Posted,Duration,Lat,Long,Shape,SS Status,Unique ID
627-lancaster-disk,lancaster,Brilliantsilver disk. 50 to 55 degree angle of sight. Appears to be stationary in sky.Smaller object 1/8 the size of largersame color,us,04/02/2019,180,34.69806,-118.13583,disk,Active,SS-7717
628-hesperia-other,hesperia,High Altitude partially luminescent rocket contrail. In the direction towards Lucerne Valley.,us,04/02/2019,900,34.42639,-117.30000,other,Active,SS-7716
6293-gb-Sleigh,oxford (uk/england),the Sleigh was bright and went from horizon to horizon in 3 minutes. There was no sound.,gb,08/05/2001,180,51.75000,-1.25000,Sleigh,Active,SS-8685
629-sierra vista-Sleigh,sierra vista,Saw what I thought were 2 military planes flying in sleigh--both had anber/yellow light. Ones light was solid and others was flashin,us,04/02/2019,600,31.55444,-110.30306,Sleigh,Pending,SS-7715
62-i-405 north-bound between 124th and 160th-fireball,i-405 north-bound between 124th and 160th,A very bright tourqoise ball with a red tail close to the ground seemed to explode or flash out at tree level.,us,11/01/2018,4,0.00000,0.00000,fireball,Pending,SS-8272
6309-gb-light,aberdeen (uk/scotland),I was out with friends we saw what we thought were shooting stars we were wrong.,gb,08/05/2001,1200,57.16667,-2.66667,light,Pending,SS-8684
630-charlotte-fireball,charlotte,Im an Engieer and former Air Traffic controller. I spotted a Green Fireball. I waited to hear someone else report this but none els ha,us,04/02/2019,14,35.22694,-80.84333,fireball,Active,SS-7714
6310-gb-disk,hemel hempstead (uk/england),the craft was largegolden in colorsphere shaped travelling fast........,gb,08/05/2001,180,51.75000,-0.46667,disk,Active,SS-8683
631-everett-light,everett,I saw two lights one above the other at an angle in the western sky. The lights were moving fairly slowly. The lights were flickering,us,04/02/2019,0,47.97917,-122.20083,light,Pending,SS-7713
6325-gb-oval,yorkshire (south) (uk/england),STRANGE SOUNDS  COMING FROM  OUT SIDE  WENT TO INVESTERGATE  THEN SAW  STRANGE OBGECT IN SKY,gb,08/05/2001,300,54.00000,-1.50000,oval,Pending,SS-8682
632-new york city-light,new york city,2 lights stationary in the sky with unusual air traffic in area,us,04/02/2019,2700,40.71417,-74.00639,light,Closed,SS-7712
6336-gb-diamond,worthing (uk/england),U.F.O IN SURRY FOR 1 HOUR,gb,08/05/2001,3600,50.80000,-0.36667,diamond,Closed,SS-8681
633-point marion (near 60 miles south of pittsburgh)-light,point marion (near 60 miles south of pittsburgh),Two lights similar to planets but with unusual coloration and slow but discernable motion. Each eventually faded from sight.,us,04/02/2019,900,39.73889,-79.89889,light,Active,SS-7711
634-laverne-Sleigh,laverne,Started as a large orange sphere with some sparks coming from it . then broke into two. then four these stayed in sleigh then disent,us,04/02/2019,720,0.00000,0.00000,Sleigh,Pending,SS-7710
6351-gb-circle,edinburgh (uk/scotland),object speeds off turning at right angles as it goes,gb,08/05/2001,60,55.83333,-3.08333,circle,Active,SS-8680
635-poway-light,poway,Saw 2 points of light moving slowly across sky then after 11 minutes 1 of them streaked off towards the east and was gone in 10-12 sec,us,04/02/2019,660,32.96278,-117.03500,light,Pending,SS-7709
636-los angeles-fireball,los angeles,first saw it as a white light with a brilliant orange tail tail disappeared white light continued across sky east and then seemed to b,us,04/02/2019,420,34.05222,-118.24278,fireball,Pending,SS-7708
6378-au-Sleigh,sydney (nsw australia),It was a grey sleighy shaped object hurdling to Earht however i only saw a glimpse of it.,au,12/05/2001,23,-33.86148,151.20548,Sleigh,Active,SS-8970
637-vandenburg afb-Sleigh,vandenburg afb,From Santa Barbara: No LA fireball VAFB missle launch Peter and Art Ive seen them from as far away as Vegas in the past. 70 miles we,us,04/02/2019,0,34.75821,-120.51640,Sleigh,Active,SS-7707
6381-gb-triangle,london (uk/england),Flying Pyramid over London....,gb,12/05/2001,480,51.51412,-0.09369,triangle,Closed,SS-8679
638-la verne-fireball,la verne,I was driving us on Interstate freeway 10 due west at the junction of the 210 freeway when I saw what looked like a flare except th,us,04/02/2019,120,34.10083,-117.76694,fireball,Closed,SS-7706
639-pomona-sphere,pomona,Classic very bright to golden-orange fireball,us,04/02/2019,90,0.00000,0.00000,sphere,Pending,SS-7705
63-seattle-fireball,seattle,FIREBALL CAME STRAIGHT DOWN FROM THE SKY IT HAD A TAIL GOING STRAIGHT UP LASTED 2 TO 3 SECONDS AND DISAPPEARED.,us,11/01/2018,3,47.60639,-122.33083,fireball,Active,SS-8275
640-los alamitos-other,los alamitos,traveling east over the tree tops in the distance light greyish white object. About the size of a thumb in the sky. Looked like what s,us,04/02/2019,3,33.80306,-118.07167,other,Pending,SS-7704
6415-au-Sleigh,melbourne (vic australia),Four lights were circling around in sky proved fact that lights were not beams from ground as clouds blocked the lights. Sleigh.,au,12/05/2001,1800,-37.81394,144.96342,Sleigh,Closed,SS-8973
641-huntsville-light,huntsville,2 lights 1 large 1 small hovered in the sky for over 35 minutes.  it never moved once during this time and then all at once it disap,us,04/02/2019,2400,30.72333,-95.55056,light,Active,SS-7703
642-las vegas/montezuma-light,las vegas/montezuma,Two horizontal parallel rows of lights approximately 1/4 mile up moving  from the south to the north.,us,04/02/2019,300,35.59113,-105.23252,light,Active,SS-7702
6437-gb-egg,london (uk/england),Glowing egg shaped craft,gb,12/05/2001,1800,51.51412,-0.09369,egg,Pending,SS-8678
643-interlochen-light,interlochen,There may have been two objects.  I noticed what appeared to be two planets VERY close together in the sky at about 25-30 degrees above,us,04/02/2019,1800,44.64472,-85.76722,light,Active,SS-7701
6444-gb-sphere,shepton mallet (uk/england),Shere shaped object which shot off at high speed,gb,12/05/2001,20,51.18972,-2.54722,sphere,Active,SS-8676
644-north carolina (southeast part)-sphere,north carolina (southeast part),while driving north on interstate 95 my mother and i had just crossed the border into north carolina we saw a red spherical light cro,us,04/02/2019,10,35.75957,-79.01930,sphere,Closed,SS-7700
645-clarkdale-disk,clarkdale,my girlfriend and I had returned from dinner and were preparing to retire.  we had been looking casually at the sky out the bedroom win,us,04/02/2019,3600,34.77111,-112.05722,disk,Pending,SS-7699
646-deer valley airport-phoenix (north of)-other,deer valley airport-phoenix (north of),Bright green ball with changes in direction long tail,us,04/02/2019,10,33.68833,-112.08222,other,Pending,SS-7698
647-austin-Sleigh,austin,The sleigh was roof high and I observed it very closely for at least 3 to 5 minutes,us,04/02/2019,7,30.26694,-97.74278,Sleigh,Active,SS-7697
648-phoenix (north of)-fireball,phoenix (north of),Adding to prev. report,us,04/02/2019,10,33.44833,-112.07333,fireball,Active,SS-7696
6490-gb-fireball,horsham (uk/england),Fireball.,gb,12/05/2001,20,51.05000,-0.33333,fireball,Pending,SS-8677
649-chicago-fireball,chicago,Looking to the NNE at 5:20 A.M. I perchanced to see a fluorescent green fire fireball about the size of a dime at arms length.  Trail,us,04/02/2019,3,41.85000,-87.65000,fireball,Pending,SS-7695
64-tumwater (driving n on i-5)-fireball,tumwater (driving n on i-5),Large Blue Fireball with a tail flying in a northern direction.  This object was not a typical falling star. The object than disappeare,us,11/01/2018,3,47.00750,-122.90806,fireball,Pending,SS-8273
650-fox point-fireball,fox point,A large green fireball traveled from west to east and decended into lake Michigan,us,04/02/2019,15,43.15750,-87.90167,fireball,Active,SS-7694
651-big bend-fireball,big bend,driving eastbound on hwy l in big bend I thought it was a metorite in the atmosphere hitting the ground somewhere south of milwaukee,us,04/02/2019,2,42.88139,-88.20667,fireball,Active,SS-7693
6520-au-Sleigh,perth (western australia),I saw three bright objects travelling together they were far away their velocity changed and one stoped its motion.,au,12/05/2001,300,-31.95224,115.86140,Sleigh,Pending,SS-8968
6526-gb-light,luton (uk/england),light moving in a line before dissappearing,gb,12/05/2001,120,51.88333,-0.41667,light,Active,SS-8673
652-edwards afb-other,edwards afb,A bell shape highly polished very shiny.,us,04/02/2019,5,34.92403,-117.89121,other,Closed,SS-7692
6531-gb-circle,london (uk/england),round orange objects over london england,gb,12/05/2001,6,51.51412,-0.09369,circle,Active,SS-8675
653-north houston-Sleigh,north houston,looking for orion in the sky saw a black object zig zag and dissapear.,us,04/02/2019,2,29.92528,-95.51500,Sleigh,Active,SS-7691
654-gent oost vlaanderen (belgium)-Sleigh,gent oost vlaanderen (belgium),It seemed to be flying very low without making noise. It was very big and it seemed to be that the front of the sleigh was lighting up,us,04/02/2019,5,51.05434,3.71742,Sleigh,Pending,SS-7690
6551-gb-other,cambridge (uk/england),grey boomerang almost tye same colour as the sky,gb,03/06/2001,40,51.73333,-2.36667,other,Closed,SS-8671
6554-gb-sleigh,st. albans (uk/england),One bright flare-like light with 3 pinpoint lights moving towards it,gb,03/06/2001,300,51.75000,-0.33333,sleigh,Pending,SS-8674
6555-de-cigar,wildflecken (germany),During a training excerise @ the US Army training center @ Wildflecken germany;at appx. 23:30 hours at an elevation appx.8k ft. alt.,de,03/06/2001,300,50.36667,9.91667,cigar,Pending,SS-8786
6556-gb-disk,glasgow (uk/scotland),weirdest thing we have ever seen certainly not an aircraft,gb,03/06/2001,180,55.83333,-4.25000,disk,Active,SS-8669
655-congers-other,congers,Two possibly three comet-like objects in the nighttime western sky.  Appeared motionless and looked exactly like comets.,us,04/02/2019,420,41.15056,-73.94583,other,Closed,SS-7689
656-johnson city (over northern sky)-fireball,johnson city (over northern sky),It was a green fireball with a green trailer streaking straight into the horizon.,us,04/02/2019,2,42.11556,-75.95917,fireball,Pending,SS-7688
657-san jose-oval,san jose,Saw an unidentified aircraft flying at very high speed while landing at San Jose Intl Airport.,us,04/02/2019,10,37.33944,-121.89389,oval,Pending,SS-7687
6585-gb-Sleigh,leeds (uk/england),A Sleigh mistaken for an aeroplane caught on camera.,gb,03/06/2001,2,53.80000,-1.58333,Sleigh,Pending,SS-8672
658-gilroy (approximatly)-flash,gilroy (approximatly),While driving North on the 101 85 miles South of San Francisco I saw a bright flash transverse the sky from zenith to almost the horiz,us,04/02/2019,4,37.00583,-121.56722,flash,Active,SS-7686
6596-gb-Sleigh,pewsey (uk/england),a star or a Sleigh but it moved?,gb,03/06/2001,60,51.33333,-1.75000,Sleigh,Active,SS-8667
659-crown point-light,crown point,a bright light with red highlights it also had dim white lights in a sphere shape approx. eight lights,us,04/02/2019,60,41.41694,-87.36528,light,Pending,SS-7685
65-roseville-fireball,roseville,small red fireball with long white tail moving West at a very high speed parallel to the ground,us,11/01/2018,15,38.75222,-121.28694,fireball,Closed,SS-8270
6607-gb-Sleigh,london (uk/england),may 93 ].8pm Sleigh over north london,gb,03/06/2001,1800,51.51412,-0.09369,Sleigh,Active,SS-8670
660-bremerton-other,bremerton,Looked up lastnight surprised to see (stars) when the weather had been rainy most of the day.  My attention was directed to sudden mov,us,04/02/2019,300,47.56750,-122.63139,other,Active,SS-7684
661-mt. holly springs (viewed from)-Sleigh,mt. holly springs (viewed from),Was observing a jet aircraft at altitude and manifesting contrail.  Suddenly a second object brightly reflecting sunlight closed ra,us,04/02/2019,3,0.00000,0.00000,Sleigh,Active,SS-7682
662-i-84  (near id/ut border)-light,i-84  (near id/ut border),A bright light in the night sky above I-84 near Idaho Utah border.,us,04/02/2019,60,42.93638,-114.95214,light,Pending,SS-7683
6632-gb-Sleigh,london (ne) (uk/england),TURPIN AVENUE COLLIER ROW ESSEX RM5 2HY. ABOVE AND TO THE REAR OF A LOW RISE BLOCK OF FLATS. LOW ALTITUDE APROX 16 - 20 METRES WIDE?,gb,08/12/2001,30,51.51412,-0.09369,Sleigh,Pending,SS-8665
663-laughlin-sleigh,laughlin,JUST PREVIOUSLY MADE A LATER REPORT THINK I SHOULD INCLUDE THISN EARLIER ONE ON SAME DAY.  STANDING OUTSIDE ONPROMINADE WALK WAY OUT S,us,04/02/2019,180,35.16778,-114.57222,sleigh,Active,SS-7680
6643-gb-cross,bournemouth (uk/england),very bright static light sighted early morning in the East on July 15th 2001,gb,08/12/2001,90,50.71667,-1.88333,cross,Active,SS-8668
664-laughlin-Sleigh,laughlin,The sleigh was roof high and I observed it very closely for at least 3 to 5 minutes,us,04/02/2019,600,35.16778,-114.57222,Sleigh,Active,SS-7681
6659-gb-Sleigh,worcestershire (uk/england),it looked like a bright star moving very fast there was no sound it moved across the sky about a mile and vanished the sky was full o,gb,08/12/2001,120,52.16667,-2.16667,Sleigh,Closed,SS-8666
665-bishop (towards on route 395 north)-light,bishop (towards on route 395 north),Traveling North on 395 I noticed a bright Light that at first appeared to be a Star.  However upon closer observation i noticed that,us,04/02/2019,600,37.36361,-118.39417,light,Closed,SS-7678
666-oudenaarde and maarkedal (between) (belgium)-light,oudenaarde and maarkedal (between) (belgium),I saw a green light that moved very fast in North-North-West direction. There was a little green tail. It didden;t make any sound.Sudde,us,04/02/2019,3,50.84693,3.60144,light,Closed,SS-7679
667-coarsegold-other,coarsegold,Two stars in west sky about 30 degrees above horison were moving back and forth. Then I saw only one. It was moving in a strange way up,us,04/02/2019,300,37.26222,-119.70000,other,Pending,SS-7676
668-laughlin-Sleigh,laughlin,The sleigh was roof high and I observed it very closely for at least 3 to 5 minutes,us,04/02/2019,600,35.16778,-114.57222,Sleigh,Pending,SS-7677
669-laughlin-light,laughlin,A group of approximately 50 adults watched 5 white lights the apparent size of bright stars maneuver in the night sky.,us,04/02/2019,480,35.16778,-114.57222,light,Active,SS-7674
66-scottsdale-other,scottsdale,I heard a very loud noise like a jet engine on the next block.  I looked in that direction (E-NE) and heard a second noise exactly the,us,11/01/2018,10,33.50917,-111.89833,other,Active,SS-8271
670-chino valley-oval,chino valley,i was out side having a smoke and it was a clear night so i looked up at the stars and just happen to see above me 2 bright lights that,us,04/02/2019,45,34.75750,-112.45306,oval,Closed,SS-7675
671-san diego-triangle,san diego,changing colors bright and fast blinking motion,us,04/02/2019,600,32.71528,-117.15639,triangle,Pending,SS-7672
672-bellingham-disk,bellingham,I was walking home from downtown Bellingham when I saw a trio of disc shaped craft hovering about 50 yards over my house. I was paralyz,us,04/02/2019,0,48.75972,-122.48694,disk,Closed,SS-7673
6739-gb-disk,london (uk/england),Transparent disk leaves nuclear plant,gb,10/12/2001,30,51.51412,-0.09369,disk,Closed,SS-8663
673-east rutherford-Sleigh,east rutherford,The sleigh was roof high and I observed it very closely for at least 3 to 5 minutes,us,04/02/2019,45,40.83389,-74.09750,Sleigh,Active,SS-7670
674-fairborn-other,fairborn,Approximately 500ft. in the air just below a low cloud line I saw a small grey spherical object hovering.  It would be best described,us,04/02/2019,180,39.82083,-84.01944,other,Active,SS-7671
675-las vegas-Sleigh,las vegas,The sleigh was roof high and I observed it very closely for at least 3 to 5 minutes,us,04/02/2019,10,36.17500,-115.13639,Sleigh,Active,SS-7668
676-covington (east of  kent)-sphere,covington (east of  kent),Round bright glowing objectblue and red top and bottombright white glow center. Hoveringmoved when I took picturereturnedleft area,us,04/02/2019,1020,47.34833,-122.11361,sphere,Closed,SS-7669
6776-gb-cross,peterborough (uk/england),glowing triangles in East Anglia U.K.,gb,10/12/2001,300,52.58333,-0.25000,cross,Pending,SS-8664
677-franklin-oval,franklin,Small oval object moving at incredible speed. Faster than the eye could follow.,us,04/02/2019,2,42.08333,-71.39722,oval,Active,SS-7666
6784-gb-triangle,clacton-on-sea (uk/england),Black triangle 1996 Essex England,gb,10/12/2001,60,51.78333,1.16667,triangle,Active,SS-8661
678-natchez-oval,natchez,Sunday morning 2/7/99 from approximately 1:30 - 2:30 am over Natchez Mississippi a stationary hovering oblong aircraft with flas,us,04/02/2019,3600,31.56028,-91.40306,oval,Pending,SS-7667
679-quartzite-egg,quartzite,Object appeared from the south/west moving parallel to and pulling away from a low-flying small jet aircraft flight path of both was,us,04/02/2019,90,33.66391,-114.22995,egg,Active,SS-7664
67-spencer-fireball,spencer,Traveling north on US Highway 71 at approx. 2am on the north edge of Spencer. Saw blueish green fireball traveling west to east.  Had r,us,11/01/2018,4,43.14139,-95.14417,fireball,Active,SS-8268
6802-gb-light,scarborough (uk/england),as i was driving from filey north yorkshire to hunmanby north yorkshire i saw a red light which appeared to be quite large and at low a,gb,10/12/2001,300,54.28722,-0.41417,light,Pending,SS-8662
680-bulls gap-sphere,bulls gap,Late in the evening on the 8th I saw 2 objects west slightly south west I saw 2 objects in the sky being chased by 2 jets.,us,04/02/2019,300,36.25694,-83.08611,sphere,Active,SS-7665
681-leon-other,leon,it was a revolving light. It would change from red to green to white,us,04/02/2019,10800,38.75056,-81.96083,other,Active,SS-7662
682-la crescenta-disk,la crescenta,The greenish ship with the other one moved across the night sky it made a sound too and then it disapered. It was really freaky,us,04/02/2019,420,34.22417,-118.23917,disk,Active,SS-7663
683-sterling-oval,sterling,Bright lights approx. 1/2 mi. east of us - was still for bout a min. or so - no sound - and the slowly moving towards the south. I saw,us,04/02/2019,240,41.34111,-75.39028,oval,Active,SS-7660
684-mesa (north of)-triangle,mesa (north of),I saw a black craft floating in the air no noise or anything.  When I got out of my car to see what was going on it left.,us,04/02/2019,90,33.42222,-111.82194,triangle,Closed,SS-7661
685-tacoma (lakewood)-sphere,tacoma (lakewood),While on Patrol in the North parking lot at Pierce College I observed a green spherical ball of light descending from west to east. Th,us,04/02/2019,0,47.25306,-122.44306,sphere,Pending,SS-7659
686-jewell basin national park-other,jewell basin national park,Two craft near Camp Misery ranger station one large triangular one small very small cone shaped.,us,04/02/2019,300,48.17024,-113.92428,other,Active,SS-7658
687-collingdale-Sleigh,collingdale,The sleigh was roof high and I observed it very closely for at least 3 to 5 minutes,us,04/02/2019,0,39.91167,-75.27750,Sleigh,Pending,SS-7657
688-greendale-diamond,greendale,I work in a suberb of milwaukee Wi and it is not really that unpopulated  however i get off work at 2:30 and about 5 min into my ride,us,04/02/2019,300,42.94056,-87.99583,diamond,Pending,SS-7656
689-las vegas (north of)-Sleigh,las vegas (north of),Im a truck driver.I have made trips to the desert n. of Vegas. Out in the desert in the middle of the night. my cargo was unknown. Bi,us,04/02/2019,0,36.17500,-115.13639,Sleigh,Closed,SS-7655
68-vancouver (watching from field at barn)-fireball,vancouver (watching from field at barn),Saw a large ball of light while at my barn in the evening.  The sky was clear no rain clouds.  It sailed over my head due north.,us,11/01/2018,15,45.63889,-122.66028,fireball,Pending,SS-8269
6909-de-circle,weissenburg (germany),the object grew big and schrank again then flew away like lightning,de,10/12/2001,90,50.73333,11.45000,circle,Closed,SS-8790
690-jacksonville-triangle,jacksonville,Delta wing shaped craft approx 60-70 in diameter/tip to tip hovered @ 11:00 for about 1 min. No sound. six round depression on undersi,us,04/02/2019,60,30.33194,-81.65583,triangle,Active,SS-7654
691-las vegas-light,las vegas,Two large amber orbs appeared/hovered due North/West of the Stratosphere Tower. Hovered for five to ten minutes. They remained stationa,us,04/02/2019,900,36.17500,-115.13639,light,Pending,SS-7652
692-lemont-triangle,lemont,Sighting of a triangular craft by my daughter and then myself.  My daughter actually drove under the object.  Describes it as an equila,us,04/02/2019,360,41.67361,-88.00167,triangle,Pending,SS-7653
693-rockmart-other,rockmart,it was a huge triangle shaped object with a beam in the middle of it sort of like a laser pointer except wider.and blue lights on the s,us,04/02/2019,0,34.00250,-85.04167,other,Pending,SS-7650
694-santa rosa-triangle,santa rosa,Travled very fast north to south. Lights on all points. Very little sound.,us,04/02/2019,4,38.44056,-122.71333,triangle,Active,SS-7651
695-salinas-Sleigh,salinas,The sleigh was roof high and I observed it very closely for at least 3 to 5 minutes,us,04/02/2019,180,36.67778,-121.65444,Sleigh,Active,SS-7648
6967-gb-Sleigh,ipswich (suffolk) (uk/england),We were sitting on the lawn at a Bed &amp; Breakfast in Pipps Ford Suffolk UK looking at the stars on a particularly clear night. We saw a,gb,10/12/2001,60,52.08333,1.16667,Sleigh,Active,SS-8659
696-piney (lawrence county (rural) )-light,piney (lawrence county (rural) ),hovering light no sound exited at very high rate of speed,us,04/02/2019,600,36.01500,-84.55833,light,Active,SS-7649
697-eagle mountain-light,eagle mountain,My husband was standing in our living room when he noticed two objects in the east he called me to come see. There were two strange cr,us,04/02/2019,240,32.89333,-97.44417,light,Active,SS-7646
698-del mar-triangle,del mar,It was green with flashing lights. Bright red lights. White lights towarsdthe front.,us,04/02/2019,0,32.95944,-117.26444,triangle,Active,SS-7647
6991-gb-other,nottingham (uk/england),a bright object like a fireball  i was on my way home very dark night when i saw a fire ball of a sort of craft it came out of no were,gb,10/12/2001,3,52.96667,-1.16667,other,Pending,SS-8660
699-columbus-fireball,columbus,3 objects within 30 minutes,us,04/02/2019,1800,39.96111,-82.99889,fireball,Closed,SS-7644
69-newport-Sleigh,newport,The sleigh was roof high and I observed it very closely for at least 3 to 5 minutes,us,11/01/2018,1,35.96694,-83.18778,Sleigh,Active,SS-8266
6-vega baja (puerto rico)-Sleigh,vega baja (puerto rico),The sleigh was roof high and I observed it very closely for at least 3 to 5 minutes,us,11/01/2018,120,18.44639,-66.38806,Sleigh,Active,SS-8331
7005-gb-egg,nottingham (uk/england),we was on a return journey from visiting familywhen a light almost blinded me .my passenger turned to me and said look out behind i l,gb,10/12/2001,12,52.96667,-1.16667,egg,Active,SS-8656
700-phoenix-Sleigh,phoenix,The sleigh was roof high and I observed it very closely for at least 3 to 5 minutes,us,04/02/2019,300,33.44833,-112.07333,Sleigh,Pending,SS-7645
701-angeles crest hwy-sphere,angeles crest hwy,I was out of my car on the highway releaving myself when a very bright sphere shaped object came out of the valley and flew strait up.,us,04/02/2019,5,34.34360,-117.90969,sphere,Active,SS-7642
702-waipahu peninsula (waipahu)-light,waipahu peninsula (waipahu),Facing 170-180 saw brilliant flash at 65 deg azimuth. Color: White no blue red or orange.  Traveled from N - S.,us,04/02/2019,13,21.37316,-157.99610,light,Active,SS-7643
703-diamond bar-sphere,diamond bar,Id just finished watching a video and had gathered my things to go upstairs.  When I walked into my bedroom I saw Id left the drapes,us,04/02/2019,2,34.02861,-117.80944,sphere,Active,SS-7641
7048-gb-egg,blackburn (uk/england),Egg shaped object. Managed to film it for about 30 mins,gb,10/12/2001,7200,55.86667,-3.63333,egg,Active,SS-8658
704-cowansville-triangle,cowansville,Myself and 3 other people saw a very large triangular space ship appear over the treeline along the edge of a field on our farm.,us,04/02/2019,120,40.88778,-79.58861,triangle,Pending,SS-7640
705-parma-triangle,parma,V-shaped object flying from South to North estimated to be at high altitude because high cirrus clouds visible through mostly clear ski,us,04/02/2019,10,41.40472,-81.72306,triangle,Closed,SS-7639
706-lihue-light,lihue,Bright green lights floating in space with a strange motion pattern.,us,04/02/2019,300,21.98111,-159.37111,light,Pending,SS-7638
707-de-rectangle,baumholder (germany),Saw glowing rectangular but possibly cylindrical object that did not appear to be an aircraft during daylight hours.,de,04/02/2019,180,49.61667,7.33333,rectangle,Closed,SS-8800
708-shelby township-light,shelby township,A white light with a red light on the left and a green light on the right darting in the sky,us,04/02/2019,10800,42.67078,-83.03299,light,Pending,SS-7637
709-wilmington island (savannah)-fireball,wilmington island (savannah),It was a red ball of light that didnt move.,us,04/02/2019,9,32.00333,-80.97389,fireball,Active,SS-7636
70-observer enroute on mn hwy 61 north-sphere,observer enroute on mn hwy 61 north,skies o/cast. Objt. had app. of a meteor but w/ distinct green color. Initially dismissed as meteor,us,11/01/2018,5,46.72955,-94.68590,sphere,Pending,SS-8267
710-atmore-light,atmore,BRIGHT STAR CHARACTERISTIC IN FIXED POSITION THEN IT MOVED STRAIGHT UP INTO THE AIR AS IT DID SO THE LIGHT WENT OFF &amp; A RED &amp; GREEN LIG,us,04/02/2019,600,31.02361,-87.49389,light,Closed,SS-7635
711-seattle-sphere,seattle,Commercial Airline Flight From Juneau AK to Seattle,us,04/02/2019,5,47.60639,-122.33083,sphere,Active,SS-7634
712-albuquerque-sphere,albuquerque,I saw a silver sphere shaped craft that was following in the contrail of a passenger or military aircraft.,us,04/02/2019,300,35.08444,-106.65056,sphere,Pending,SS-7633
